{
  "generated_at_utc": "2026-03-28T03:53:35.854978+00:00",
  "source": {
    "name": "FloridaHealthFinder Facility Search",
    "url": "https://quality.healthfinder.fl.gov/Facility-Search/FacilityLocateSearch",
    "handler": "https://quality.healthfinder.fl.gov/Facility-Search/FacilityLocateSearch?handler=AdvancedSearch",
    "notes": [
      "Counts generated from official county-filtered advanced search responses.",
      "Acute care context currently uses FacilityType=Hospital.",
      "Long-term care context currently uses FacilityType=Nursing-Home."
    ]
  },
  "population_source": {
    "name": "U.S. Census Bureau County Population Totals: 2020-2025",
    "url": "https://www.census.gov/data/tables/time-series/demo/popest/2020s-counties-total.html",
    "dataset": "https://www2.census.gov/programs-surveys/popest/tables/2020-2025/counties/totals/co-est2025-pop-12.xlsx",
    "notes": [
      "Population values come from the Florida county file for Vintage 2025.",
      "The county-level resident estimate used in the app is the July 1, 2025 estimate."
    ]
  },
  "counties": {
    "Alachua": {
      "population": {
        "resident_estimate": 290028,
        "estimate_year": 2025,
        "estimate_date": "2025-07-01"
      },
      "acute_care_hospitals": {
        "facility_count": 5,
        "licensed_beds": 1766
      },
      "nursing_homes": {
        "facility_count": 9,
        "licensed_beds": 1272
      }
    },
    "Baker": {
      "population": {
        "resident_estimate": 29737,
        "estimate_year": 2025,
        "estimate_date": "2025-07-01"
      },
      "acute_care_hospitals": {
        "facility_count": 2,
        "licensed_beds": 1163
      },
      "nursing_homes": {
        "facility_count": 2,
        "licensed_beds": 188
      }
    },
    "Bay": {
      "population": {
        "resident_estimate": 204479,
        "estimate_year": 2025,
        "estimate_date": "2025-07-01"
      },
      "acute_care_hospitals": {
        "facility_count": 5,
        "licensed_beds": 796
      },
      "nursing_homes": {
        "facility_count": 8,
        "licensed_beds": 933
      }
    },
    "Bradford": {
      "population": {
        "resident_estimate": 28307,
        "estimate_year": 2025,
        "estimate_date": "2025-07-01"
      },
      "acute_care_hospitals": {
        "facility_count": 1,
        "licensed_beds": 5
      },
      "nursing_homes": {
        "facility_count": 2,
        "licensed_beds": 240
      }
    },
    "Brevard": {
      "population": {
        "resident_estimate": 663982,
        "estimate_year": 2025,
        "estimate_date": "2025-07-01"
      },
      "acute_care_hospitals": {
        "facility_count": 11,
        "licensed_beds": 1632
      },
      "nursing_homes": {
        "facility_count": 21,
        "licensed_beds": 2819
      }
    },
    "Broward": {
      "population": {
        "resident_estimate": 2013317,
        "estimate_year": 2025,
        "estimate_date": "2025-07-01"
      },
      "acute_care_hospitals": {
        "facility_count": 25,
        "licensed_beds": 6751
      },
      "nursing_homes": {
        "facility_count": 32,
        "licensed_beds": 4382
      }
    },
    "Calhoun": {
      "population": {
        "resident_estimate": 13289,
        "estimate_year": 2025,
        "estimate_date": "2025-07-01"
      },
      "acute_care_hospitals": {
        "facility_count": 1,
        "licensed_beds": 18
      },
      "nursing_homes": {
        "facility_count": 2,
        "licensed_beds": 246
      }
    },
    "Charlotte": {
      "population": {
        "resident_estimate": 217212,
        "estimate_year": 2025,
        "estimate_date": "2025-07-01"
      },
      "acute_care_hospitals": {
        "facility_count": 2,
        "licensed_beds": 512
      },
      "nursing_homes": {
        "facility_count": 9,
        "licensed_beds": 1260
      }
    },
    "Citrus": {
      "population": {
        "resident_estimate": 171666,
        "estimate_year": 2025,
        "estimate_date": "2025-07-01"
      },
      "acute_care_hospitals": {
        "facility_count": 3,
        "licensed_beds": 368
      },
      "nursing_homes": {
        "facility_count": 9,
        "licensed_beds": 1103
      }
    },
    "Clay": {
      "population": {
        "resident_estimate": 239593,
        "estimate_year": 2025,
        "estimate_date": "2025-07-01"
      },
      "acute_care_hospitals": {
        "facility_count": 4,
        "licensed_beds": 742
      },
      "nursing_homes": {
        "facility_count": 11,
        "licensed_beds": 1260
      }
    },
    "Collier": {
      "population": {
        "resident_estimate": 417131,
        "estimate_year": 2025,
        "estimate_date": "2025-07-01"
      },
      "acute_care_hospitals": {
        "facility_count": 7,
        "licensed_beds": 1215
      },
      "nursing_homes": {
        "facility_count": 11,
        "licensed_beds": 876
      }
    },
    "Columbia": {
      "population": {
        "resident_estimate": 74094,
        "estimate_year": 2025,
        "estimate_date": "2025-07-01"
      },
      "acute_care_hospitals": {
        "facility_count": 2,
        "licensed_beds": 177
      },
      "nursing_homes": {
        "facility_count": 4,
        "licensed_beds": 418
      }
    },
    "Desoto": {
      "population": {
        "resident_estimate": 37078,
        "estimate_year": 2025,
        "estimate_date": "2025-07-01"
      },
      "acute_care_hospitals": {
        "facility_count": 1,
        "licensed_beds": 49
      },
      "nursing_homes": {
        "facility_count": 1,
        "licensed_beds": 118
      }
    },
    "Dixie": {
      "population": {
        "resident_estimate": 18038,
        "estimate_year": 2025,
        "estimate_date": "2025-07-01"
      },
      "acute_care_hospitals": {
        "facility_count": 0,
        "licensed_beds": 0
      },
      "nursing_homes": {
        "facility_count": 1,
        "licensed_beds": 60
      }
    },
    "Duval": {
      "population": {
        "resident_estimate": 1062963,
        "estimate_year": 2025,
        "estimate_date": "2025-07-01"
      },
      "acute_care_hospitals": {
        "facility_count": 19,
        "licensed_beds": 4600
      },
      "nursing_homes": {
        "facility_count": 33,
        "licensed_beds": 4344
      }
    },
    "Escambia": {
      "population": {
        "resident_estimate": 333834,
        "estimate_year": 2025,
        "estimate_date": "2025-07-01"
      },
      "acute_care_hospitals": {
        "facility_count": 5,
        "licensed_beds": 1668
      },
      "nursing_homes": {
        "facility_count": 16,
        "licensed_beds": 2003
      }
    },
    "Flagler": {
      "population": {
        "resident_estimate": 140360,
        "estimate_year": 2025,
        "estimate_date": "2025-07-01"
      },
      "acute_care_hospitals": {
        "facility_count": 2,
        "licensed_beds": 199
      },
      "nursing_homes": {
        "facility_count": 2,
        "licensed_beds": 240
      }
    },
    "Franklin": {
      "population": {
        "resident_estimate": 13029,
        "estimate_year": 2025,
        "estimate_date": "2025-07-01"
      },
      "acute_care_hospitals": {
        "facility_count": 1,
        "licensed_beds": 25
      },
      "nursing_homes": {
        "facility_count": 1,
        "licensed_beds": 90
      }
    },
    "Gadsden": {
      "population": {
        "resident_estimate": 44298,
        "estimate_year": 2025,
        "estimate_date": "2025-07-01"
      },
      "acute_care_hospitals": {
        "facility_count": 2,
        "licensed_beds": 953
      },
      "nursing_homes": {
        "facility_count": 1,
        "licensed_beds": 120
      }
    },
    "Gilchrist": {
      "population": {
        "resident_estimate": 20488,
        "estimate_year": 2025,
        "estimate_date": "2025-07-01"
      },
      "acute_care_hospitals": {
        "facility_count": 0,
        "licensed_beds": 0
      },
      "nursing_homes": {
        "facility_count": 2,
        "licensed_beds": 201
      }
    },
    "Glades": {
      "population": {
        "resident_estimate": 13270,
        "estimate_year": 2025,
        "estimate_date": "2025-07-01"
      },
      "acute_care_hospitals": {
        "facility_count": 0,
        "licensed_beds": 0
      },
      "nursing_homes": {
        "facility_count": 0,
        "licensed_beds": 0
      }
    },
    "Gulf": {
      "population": {
        "resident_estimate": 15943,
        "estimate_year": 2025,
        "estimate_date": "2025-07-01"
      },
      "acute_care_hospitals": {
        "facility_count": 1,
        "licensed_beds": 19
      },
      "nursing_homes": {
        "facility_count": 1,
        "licensed_beds": 120
      }
    },
    "Hamilton": {
      "population": {
        "resident_estimate": 14180,
        "estimate_year": 2025,
        "estimate_date": "2025-07-01"
      },
      "acute_care_hospitals": {
        "facility_count": 0,
        "licensed_beds": 0
      },
      "nursing_homes": {
        "facility_count": 1,
        "licensed_beds": 60
      }
    },
    "Hardee": {
      "population": {
        "resident_estimate": 25932,
        "estimate_year": 2025,
        "estimate_date": "2025-07-01"
      },
      "acute_care_hospitals": {
        "facility_count": 1,
        "licensed_beds": 25
      },
      "nursing_homes": {
        "facility_count": 1,
        "licensed_beds": 79
      }
    },
    "Hendry": {
      "population": {
        "resident_estimate": 48276,
        "estimate_year": 2025,
        "estimate_date": "2025-07-01"
      },
      "acute_care_hospitals": {
        "facility_count": 1,
        "licensed_beds": 25
      },
      "nursing_homes": {
        "facility_count": 2,
        "licensed_beds": 248
      }
    },
    "Hernando": {
      "population": {
        "resident_estimate": 221701,
        "estimate_year": 2025,
        "estimate_date": "2025-07-01"